H14439,TALL PINES LONG TERM CARE CENTRE,The Regional Municipality Of Peel,Municipality of Peel,1001 Peter Robertson Blvd.,,,,Brampton,L6R 2Y3,Ontario,Canada,Central West,Municipal,,New,160,,,,,,160,160,,,,,,,,,Municipal,,
NH3335,THE DAVIS CENTRE,Peel Housing Corporation,Peel Housing Corporation,80 Allan Drive,,,,Bolton,L7E 1P7,Ontario,Canada,Central West,Not-For-Profit,,A,64,64,,,,,,64,,,,,,,,,6/30/2035,,
NH3304,RIVERVIEW MANOR NURSING HOME,0760444 B.C. Ltd As General Partner on behalf of OMNI Health Care Limited Partnership ,OMNI,1155 Water Street,"42.078786, -76.8369814",42.07879,-76.83698,Peterborough,K9H 3P8,Ontario,Canada,Central East,For-Profit,,C,125,,,124,,,,124,,,,,,,1,,6/30/2025,Yes,
NH4494,BURTON MANOR,1245556 Ontario Inc. o/a Burton Manor,Primacare Living,5 Sterritt Drive,,,,Brampton,L6Y 5P3,Ontario,Canada,Central West,For-Profit,,New,128,,,,,,128,128,,,,,,,,,6/30/2035,,Primacare Living Solutions Inc.
NH3635,COLLINGWOOD NURSING HOME,Collingwood Nursing Home Limited,Collingwood Nursing Home Limited,250 Campbell Street,,,,Collingwood,L9Y 4J9,Ontario,Canada,North Simcoe Muskoka,For-Profit,,B,64,,64,,,,,59,4,,,1,,,,,6/30/2025,Yes,
NH2859,THE VILLAGE OF SANDALWOOD PARK,Schlegel Villages,Schlegel Villages Inc.,425 Great Lakes Drive,,,,Brampton,L6R 2W8,Ontario,Canada,Central West,For-Profit,,New,120,,,,,,120,120,,,,,,,,,6/30/2030,,
NH3338,VALLEY PARK LODGE,955464 Ontario Ltd,Conmed Health Care Group,6400 Valley Way,,,,Niagara Falls,L2E 7E3,Ontario,Canada,HNHB,For-Profit,,B,65,,65,,,,,64,,,,1,,,,,6/30/2025,Yes,
NH1771,SPRINGDALE COUNTRY MANOR,0760444 B.C. Ltd As General Partner on behalf of OMNI Health Care Limited Partnership ,OMNI,2698 Clifford Line,"44.2309742, -78.3967539",44.23097,-78.39675,Peterborough,K9J 6X6,Ontario,Canada,Central East,For-Profit,,C,68,,,68,,,,68,,,,,,,,,6/30/2025,Yes,
NH1599,BURNBRAE GARDENS LONG TERM CARE RESIDENCE,0760444 B.C. Ltd As General Partner on behalf of OMNI Health Care Limited Partnership ,OMNI,320 Burnbrae Road East,"44.3031768, -77.7840805",44.30318,-77.78408,Campbellford,K0L 1L0,Ontario,Canada,Central East,For-Profit,,C,43,,,43,,,,43,,,,,,,,,6/30/2025,Yes,
NH4308b,DEERWOOD CREEK CARE COMMUNITY,2063414 Ontario Limited as general partner of 2063414 Investment LP,Sienna Senior Living,70 Humberline Drive,,,,Etobicoke,M9W 7H3,Ontario,Canada,Central West,For-Profit,,A,160,160,,,,,,160,,,,,,,,,6/30/2035,,
NH1222,COPPER TERRACE,Copper Terrace Limited,Copper Terrace Limited,91 Tecumseh Road,,,,Chatham,N7M 1B3,Ontario,Canada,Erie St. Clair,For-Profit,,A / C,150,56,,94,,,,136,,2,,,12,,,,6/30/2025,Yes,
NH2887,HAWTHORN WOODS CARE COMMUNITY,2063414 Ontario Limited as general partner of 2063414 Investment LP,Sienna Senior Living,9257 Goreway Drive,,,,Brampton,L6P 0N5,Ontario,Canada,Central West,For-Profit,,New,160,,,,,,160,150,10,,,,,,,,6/30/2035,,
NH4446,MAPLE GROVE CARE COMMUNITY,2063414 Ontario Limited as general partner of 2063414 Investment LP,Sienna Senior Living,215 Sunny Meadow Blvd.,,,,Brampton,L6R 3B5,Ontario,Canada,Central West,For-Profit,,A,160,160,,,,,,160,,,,,,,,,6/30/2035,,
NH4475,WOODHALL PARK CARE COMMUNITY,The Royale Development GP Corporation as general partner of The Royale Development LP,Sienna Senior Living,10260 Kennedy Road North,,,,Brampton,L6Z 4N7,Ontario,Canada,Central West,For-Profit,,New,147,,,,,,147,147,,,,,,,,,6/30/2035,,
NH2945,WOODBRIDGE VISTA CARE COMMUNITY,2063414 Ontario Limited as general partner of 2063414 Investment LP,Sienna Senior Living,5400 Steeles Avenue West,,,,Woodbridge,L4L 9S1,Ontario,Canada,Central West,For-Profit,,New,224,,,,,,224,224,,,,,,,,,6/30/2035,,
NH3116,FAIRVIEW MANOR,Almonte General Hospital,Almonte General Hospital,75 Spring Street,,,,Almonte,K0A 1A0,Ontario,Canada,Champlain,Not-For-Profit,,New,112,,,,,,112,111,,1,,,,,,,4/16/2037,,
NH1773,CARESSANT CARE BOURGET,Caressant-Care Nursing And Retirement Homes Limited,Caressant Care,2279 Laval Street,,,,Bourget,K0A 1E0,Ontario,Canada,Champlain,For-Profit,,C / New,56,,,46,,,10,56,,,,,,,,,7/31/2023,Yes,
NH4259,CARESSANT CARE COBDEN,Caressant-Care Nursing And Retirement Homes Limited,Caressant Care,12 Wren Drive,,,,Cobden,K0J 1K0,Ontario,Canada,Champlain,For-Profit,,New,64,,,,,,64,64,,,,,,,,,6/30/2035,,
H11693,CENTRE D'ACCUEIL CHAMPLAIN,City Of Ottawa,City Of Ottawa,275 Perrier Street,,,,Vanier,K1L 5C6,Ontario,Canada,Champlain,Municipal,,A,160,160,,,,,,160,,,,,,,,,Municipal,,
H11655,CARLETON LODGE,City Of Ottawa,City Of Ottawa,55 Lodge Road,,,,Nepean,K2C 3H1,Ontario,Canada,Champlain,Municipal,,A,160,160,,,,,,160,,,,,,,,1,Municipal,,
H13364,ROCKWOOD TERRACE HOME FOR THE AGED,Corporation Of The County Of Grey,County Of Grey,575 Saddler Street East,,,,Durham,N0G 1R0,Ontario,Canada,South West,Municipal,,B,100,,100,,,,,100,,,,,,,,,Municipal,Yes,
HF4588,GARRY J. ARMSTRONG HOME,City Of Ottawa,City Of Ottawa,200 Island Lodge Road,,,,Ottawa,K1N 5M2,Ontario,Canada,Champlain,Municipal,,New,180,,,,,,180,180,,,,,,,,,Municipal,,
H14306,PETER D. CLARK CENTRE,City Of Ottawa,City Of Ottawa,9 Meridian Place,,,,Ottawa,K2G 6P8,Ontario,Canada,Champlain,Municipal,,New,211,,,,,,211,211,,,,,,,,5,Municipal,,
54510,MIRAMICHI LODGE,County Of Renfrew,County Of Renfrew,725 Pembroke Street West,,,,Pembroke,K8A 8S6,Ontario,Canada,Champlain,Municipal,,New,166,,,,,,166,162,,2,,2,,,,,Municipal,,
NH4420,THE FOUR SEASONS LODGE,Deep River And District Hospital,Deep River And District Hospital,117 Banting Drive,,,,Deep River,K0J 1P0,Ontario,Canada,Champlain,Not-For-Profit,,New,10,,,,,,10,10,,,,,,,,4,Unknown,,
NH2790,GROVES PARK LODGE,Gem Health Care Group Limited,Gem Health Care Group Limited,470 Raglan Street North,,,,Renfrew,K7V 1P5,Ontario,Canada,Champlain,For-Profit,,C / New,85,,,53,,,32,75,,,,,4,,6,11,4/19/2026,Yes,
732,KEMPTVILLE DISTRICT HOSPITAL,Kemptville District Hospital,Kemptville District Hospital,2675 Concession Road,,,,Kemptville,K0G 1J0,Ontario,Canada,Champlain,Not-For-Profit,,A,8,8,,,,,,,8,,,,,,,4,2020,,
H11602,GOLDEN PLOUGH LODGE,The Corporation Of The County Of Northumberland,County of Northumberland,983 Burnham Street,,,,Cobourg,K9A 5J6,Ontario,Canada,Central East,Municipal,,B / C,151,,64,87,,,,148,,,,3,,,,,Municipal,Yes,
NH3709,TSIIONKWANONHSOTE,Mohawk Council Of Akwesasne,Mohawk Council Of Akwesasne,70 Kawehnoke Apartments Road,,,,Akwesasne,K6H 5R7,Ontario,Canada,Champlain,Not-For-Profit,,A,50,50,,,,,,50,,,,,,,,,6/30/2035,,Assured Care
H23741,NORTH RENFREW LONG-TERM CARE SERVICES INC.,North Renfrew Long-Term Care Services Inc.,North Renfrew Long-Term Care Services Inc.,47 Ridge Road,,,,Deep River,K0J 1P0,Ontario,Canada,Champlain,Not-For-Profit,,A,21,21,,,,,,20,,1,,,,,,,6/30/2030,,
NH4301,FOREST HILL,0760444 B.C. Ltd As General Partner on behalf of OMNI Health Care Limited Partnership ,OMNI,6501 Campeau Drive,,,,Kanata,K2K 3E9,Ontario,Canada,Champlain,For-Profit,,New,156,,,,,,156,156,,,,,,,,4,Unknown,,
NH1624,FOSTERBROOKE,Revera Long Term Care Inc.,Revera,330 King Street West,"43.646693, -79.39021",43.64669,-79.39021,Newcastle,L1B 1G9,Ontario,Canada,Central East,For-Profit,,C,88,,,88,,,,87,,1,,,,,,,6/30/2025,Yes,
NH4393,GARDEN TERRACE,0760444 B.C. Ltd As General Partner on behalf of OMNI Health Care Limited Partnership ,OMNI,100 Aird Place,,,,Kanata,K2L 4H8,Ontario,Canada,Champlain,For-Profit,,New,160,,,,,,160,154,,6,,,,,,,6/30/2035,,
H21878,ST. JOSEPH'S CONTINUING CARE CENTRE,"Religious Hospitalers Of St. Joseph Of Cornwall, Ontario","Religious Hospitalers Of St. Joseph Of Cornwall, Ontario",14 York Street,,,,Cornwall,K6J 5T2,Ontario,Canada,Champlain,Not-For-Profit,,New,150,,,,,,150,150,,,,,,,,,12/6/2032,,
NH4322,LONGFIELDS MANOR,Revera Long Term Care Inc.,Revera,330 Beatrice Drive,,,,Nepean,K2J 5A5,Ontario,Canada,Champlain,For-Profit,,New,114,,,,,,114,114,,,,,,,,,6/30/2035,,
NH4404,MONTFORT,Revera Long Term Care Inc.,Revera,705 Montreal Road,,,,Ottawa,K1K 0M9,Ontario,Canada,Champlain,For-Profit,,New,128,,,,,,128,128,,,,,,,,,6/30/2035,,
NH4388,GRANITE RIDGE CARE COMMUNITY,Royal Development GP Corporation as general partner of The Royale Development LP,Royal Development GP Corporation as general partner of The Royale Development LP,5501 Abbott Street East,,,,Stittsville,K2S 2C5,Ontario,Canada,Champlain,For-Profit,,A,224,224,,,,,,224,,,,,,,,,6/30/2035,,
4482,ROYAL OTTAWA PLACE,Royal Ottawa Health Care Group,Royal Ottawa Health Care Group,1145 Carling Avenue,,,,Ottawa,K1Z 7K4,Ontario,Canada,Champlain,Not-For-Profit,,New,70,,,,,,70,63,,1,,,6,,,,6/30/2030,,
NH2636,REACHVIEW VILLAGE,Revera Long Term Care Inc.,Revera,130 Reach Street,"44.1040786, -79.1118959",44.10408,-79.11190,Uxbridge,L9P 1L3,Ontario,Canada,Central East,For-Profit,,C,100,,,100,,,,100,,,,,,,,,6/30/2025,Yes,
NH3654,CROWN RIDGE PLACE,Crown Ridge Health Care Services Inc.,Crown Ridge Health Care Services Inc.,106 Crown Street,,,,Trenton,K8V 6R3,Ontario,Canada,South East,For-Profit,,A / New,122,26,,,,,96,121,,1,,,,,,,8/23/2039,,
NH1186,WESTGATE LODGE NURSING HOME,Crown Ridge Health Care Services Inc.,Crown Ridge Health Care Services Inc.,37 Wilkie Street,,,,Belleville,K8P 4E4,Ontario,Canada,South East,For-Profit,,A / B,88,24,64,,,,,87,,1,,,,,,,6/30/2025,Yes,
NH4687,MADONNA CARE COMMUNITY,Sienna Senior Living,Sienna Senior Living,1541 St. Joseph Boulevard,,,,Orleans,K1C 7L3,Ontario,Canada,Champlain,For-Profit,,New,160,,,,,,160,160,,,,,,,,,10/8/2037,,
95842,MANOIR MAROCHEL,CVH (No. 4) GP Inc. as general partner of CVH (No. 4) LP,Southbridge,949 Montreal Road,,,,Ottawa,K1K 0S6,Ontario,Canada,Champlain,For-Profit,,A,64,64,,,,,,64,,,,,,,,,6/30/2035,,Extendicare Assist
NH1631,THORNTONVIEW,Revera Long Term Care Inc.,Revera,186 Thornton Road South,"43.885835, -78.89222699999999",43.88584,-78.89223,Oshawa,L1J 5Y2,Ontario,Canada,Central East,For-Profit,,C,154,,,104,,,50,154,,,,,,,,,7/1/2022,Yes,
NH1352,KENNEDY LODGE,Revera Long Term Care Inc.,Revera,1400 Kennedy Road,"43.7626344, -79.28056230000001",43.76263,-79.28056,Scarborough,M1P 4V6,Ontario,Canada,Central East,For-Profit,,C,289,,,289,,,,263,18,1,,,7,,,,6/30/2025,Yes,
H21688,ST PATRICK'S HOME,St. Patrick's Home Of Ottawa Inc.,St. Patrick's Home Of Ottawa Inc.,2865 Riverside Drive,,,,Ottawa,K1V 8N5,Ontario,Canada,Champlain,Not-For-Profit,,New,45,,,,,,288,286,,2,,,,,,,12/29/2043,,
NH22848,TONY STACEY CENTRE FOR VETERANS' CARE,Royal Canadian Legion District 'd' Care Centres,Royal Canadian Legion District 'd' Care Centres,59 Lawson Road,"43.783966, -79.16412400000002",43.78397,-79.16412,Toronto,M1C 2J1,Ontario,Canada,Central East,Not-For-Profit,,C,100,,,100,,,,94,,4,,2,,,,,6/30/2025,Yes,
NH1344,ALTAMONT CARE COMMUNITY,Vigour Limited Partnership on behalf of Vigour General Partner Inc.,Sienna Senior Living,92 Island Road,"41.8579117, -71.9002806",41.85791,-71.90028,Scarborough,M1C 2P5,Ontario,Canada,Central East,For-Profit,,C,159,,,159,,,,157,,2,,,,,,,6/30/2025,Yes,
NH1358,ROCKCLIFFE CARE COMMUNITY,Vigour Limited Partnership on behalf of Vigour General Partner Inc.,Sienna Senior Living,3015 Lawrence Avenue East,"43.7546689, -79.2478902",43.75467,-79.24789,Scarborough,M1P 2V7,Ontario,Canada,Central East,For-Profit,,C,204,,,204,,,,202,,2,,,,,,,6/30/2025,Yes,
NH1606,HOPE STREET TERRACE,CVH (No. 6) GP Inc. as General Partner of CVH (No. 6) LP,Southbridge,20 Hope Street South,"43.9545521, -78.28841229999999",43.95455,-78.28841,Port Hope,L1A 2M8,Ontario,Canada,Central East,For-Profit,,C,97,,,97,,,,97,,,,,,,,,6/30/2025,Yes,Extendicare Assist
NH1605,REGENCY LONG TERM CARE HOME,CVH (No. 6) GP Inc. as General Partner of CVH (No. 6) LP,Southbridge,66 Dorset Street East,"43.9507895, -78.2880376",43.95079,-78.28804,Port Hope,L1A 1E3,Ontario,Canada,Central East,For-Profit,,C,60,,,60,,,,58,,2,,,,,,,6/30/2025,Yes,Extendicare Assist
H11873,GLEN-STOR-DUN LODGE,The Corporation Of The City Of Cornwall,The Corporation Of The City Of Cornwall,1900 Montreal Road,,,,Cornwall,K6H 7L1,Ontario,Canada,Champlain,Municipal,,A,132,132,,,,,,129,,1,,2,,,,,Municipal,,
NH3632,EDEN HOUSE NURSING HOME,Eden House Care Facility Inc.,Eden House Care Facility Inc.,5016 Wellington County Road 29,,,,Guelph,N1H 6H8,Ontario,Canada,Waterloo Wellington,For-Profit,,B,58,,58,,,,,58,,,,,,,,,6/30/2025,Yes,
NH1647,SUNNYCREST NURSING HOME,Sunnycrest Nursing Homes Limited,Sunnycrest Nursing Homes Limited,1635 Dundas Street East,"43.8867536, -78.9090085",43.88675,-78.90901,Whitby,L1N 2K9,Ontario,Canada,Central East,For-Profit,,C,136,,,136,,,,136,,,,,,,,,6/30/2025,Yes,
H11812,BONNECHERE MANOR,The County Of Renfrew Bonnechere Manor Long Term Care Home,The County Of Renfrew Bonnechere Manor Long Term Care Home,470 Albert Street,,,,Renfrew,K7V 4L5,Ontario,Canada,Champlain,Municipal,,A,180,180,,,,,,176,,2,,2,,,,,Municipal,,
NH3731,EHATARE NURSING HOME,Estonian Relief Committee In Canada,Estonian Relief Committee In Canada,40 Old Kingston Road,,,,Scarborough,M1E 3J5,Ontario,Canada,Central East,Not-For-Profit,,B,32,,32,,,,,32,,,,,,,,,6/30/2025,Yes,
NH2795,TENDERCARE LIVING CENTRE,Tendercare Nursing Homes Limited,Tendercare Nursing Homes Limited,1020 McNicoll Avenue,"43.80576190000001, -79.3360002",43.80576,-79.33600,Scarborough,M1W 2J6,Ontario,Canada,Central East,For-Profit,,C,254,,,254,,,,244,10,,,,,,,,6/30/2025,Yes,Extendicare Assist
NH4384,THE SALVATION ARMY OTTAWA GRACE MANOR,The Governing Council Of The Salvation Army In Canada,The Governing Council Of The Salvation Army In Canada,1156 Wellington Street,,,,Ottawa,K1Y 2Z3,Ontario,Canada,Champlain,Not-For-Profit,,New,128,,,,,,128,128,,,,,,,,,6/30/2030,,
H21660,HILLEL LODGE (THE BESS AND MOE GREENBERG FAMILY),The Ottawa Jewish Home For The Aged,The Ottawa Jewish Home For The Aged,10 Nadolny Sachs Private,,,,Ottawa,K2A 4G7,Ontario,Canada,Champlain,Not-For-Profit,,New,121,,,,,,121,121,,,,,,,,,6/30/2035,,
H23859,THE PERLEY AND RIDEAU VETERANS' HEALTH CENTRE,The Perley And Rideau Veterans' Health Centre,The Perley And Rideau Veterans' Health Centre,1750 Russell Road,,,,Ottawa,K1G 5Z6,Ontario,Canada,Champlain,Not-For-Profit,,A,450,450,,,,,,160,34,6,,250,,,,,6/30/2030,,
H23118,THE WEXFORD,The Wexford Residence Inc.,The Wexford Residence Inc.,1860 Lawrence Avenue East,"43.7439954, -79.3032015",43.74400,-79.30320,Scarborough,M1R 5B1,Ontario,Canada,Central East,Not-For-Profit,,C,166,,,166,,,,166,,,,,,,,,6/30/2025,Yes,
NH4111,VILLA MARCONI,Villa Marconi Long Term Care Center,Villa Marconi Long Term Care Center,1026 Baseline Road,,,,Ottawa,K2C 0A6,Ontario,Canada,Champlain,Not-For-Profit,,New,128,,,,,,128,128,,,,,,,,,6/30/2035,,"Diversicare Canada Management Services Co., Inc."
NH4485,CHARTWELL ROYAL OAK LONG TERM CARE RESIDENCE,Chartwell Master Care LP,Chartwell,1750 Division Road North,,,,Kingsville,N9Y 4G7,Ontario,Canada,Erie St. Clair,For-Profit,,A,160,160,,,,,,160,,,,,,,,,6/30/2030,,
NH3292,AVALON RETIREMENT CENTRE,488491 Ontario Inc.,Jarlette,355 Broadway Avenue,"41.3988752, -81.5443488",41.39888,-81.54435,Orangeville,L9W 3Y3,Ontario,Canada,Central West,For-Profit,,C,137,,,137,,,,136,,1,,,,,,,6/30/2025,Yes,
HF4670,HURON LODGE LONG TERM CARE HOME,Corporation Of The City Of Windsor,City of Windsor,1881 Cabana Road West,,,,Windsor,N9G 1C7,Ontario,Canada,Erie St. Clair,Municipal,,New,224,,,,,,224,222,,2,,,,,,,Municipal,,
NH2920,WESTSIDE,Revera Long Term Care Inc.,Revera,1145 Albion Road,"43.7372772, -79.567768",43.73728,-79.56777,Etobicoke,M9V 4J7,Ontario,Canada,Central West,For-Profit,,C,242,,,242,,,,216,,2,,,24,,,,6/30/2025,Yes,
NH3290,HUMBER VALLEY TERRACE,Revera Long Term Care Inc.,Revera,95 Humber College Blvd.,"43.7271853, -79.5966297",43.72719,-79.59663,Rexdale,M9V 5B5,Ontario,Canada,Central West,For-Profit,,C,158,,,158,,,,158,,,,,,,,,6/30/2025,Yes,
NH4333,EXTENDICARE LAKEFIELD,Extendicare (Canada) Inc.,Extendicare,19 Fraser Street,,,,Lakefield,K0L 2H0,Ontario,Canada,Central East,For-Profit,,A / New,100,40,,,,,60,98,,2,,,,,,,6/30/2035,,
NH1722,TULLAMORE CARE COMMUNITY,Vigour Limited Partnership on behalf of Vigour General Partner Inc.,Sienna Senior Living,133 Kennedy Road South,"43.6847941, -79.7360271",43.68479,-79.73603,Brampton,L6W 3G3,Ontario,Canada,Central West,For-Profit,,C,159,,,159,,,,159,,,,,,,,,6/30/2025,Yes,
NH3559,SHELBURNE LONG TERM CARE HOME,CVH (No. 8) GP Inc. as general partner of CVH (No. 8) LP,Southbridge,200 Robert Street,"44.0827207, -80.20431169999999",44.08272,-80.20431,Shelburne,L0N 1S1,Ontario,Canada,Central West,For-Profit,,C,60,,,60,,,,58,,2,,,,,,,6/30/2025,Yes,Extendicare Assist
1776,ST. JACQUES NURSING HOME,412506 Ontario Ltd.,412506 Ontario Ltd.,915 Notre Dame Street,"37.9460922, -122.0276507",37.94609,-122.02765,Embrun,K0A 1W0,Ontario,Canada,Champlain,Not-For-Profit,,C,61,,,61,,,,60,,,,,,,1,,6/30/2025,Yes,
H11071,SUN PARLOR HOME FOR SENIOR CITIZENS,The Corporation Of The County Of Essex,County of Essex,175 Talbot Street East,,,,Leamington,N8H 1L9,Ontario,Canada,Erie St. Clair,Municipal,,A,208,208,,,,,,204,,,,2,,,2,,Municipal,,
HF2796,CENTRE D'ACCUEIL ROGER SEGUIN,Centre D'Accueil Roger Seguin,Centre D'Accueil Roger Seguin,435 Lemay Street,"45.5102426, -75.2159507",45.51024,-75.21595,Clarence Creek,K0A 1N0,Ontario,Canada,Champlain,Not-For-Profit,,C,113,,,113,,,,112,,1,,,,,,,6/30/2025,Yes,
NH1781,CHARTWELL CHAMPLAIN LONG TERM CARE RESIDENCE,Chartwell Master Care Lp,Chartwell,428 Front Road West,"45.6297224, -74.67044829999999",45.62972,-74.67045,L'Orignal,K0B 1K0,Ontario,Canada,Champlain,For-Profit,,C,60,,,60,,,,60,,,,,,,,,6/30/2025,Yes,
H11245,MARSHALL GOWLAND MANOR,The Corporation Of The County Of Lambton,County of Lambton,749 Devine Street,,,,Sarnia,N7T 1X3,Ontario,Canada,Erie St. Clair,Municipal,,A,126,126,,,,,,126,,,,,,,,,Municipal,,
NH3113,CHARTWELL LANCASTER LONG TERM CARE RESIDENCE,Chartwell Master Care LP,Chartwell,105 Military Road North,"45.1462574, -74.50391499999999",45.14626,-74.50391,Lancaster,K0C 1N0,Ontario,Canada,Champlain,For-Profit,,C,60,,,60,,,,60,,,,,,,,,6/30/2025,Yes,
NH53001,DUNDAS MANOR NURSING HOME,Dundas Manor Limited,Dundas Manor Limited,533 Clarence Street,"42.9879505, -81.2498612",42.98795,-81.24986,Winchester,K0C 2K0,Ontario,Canada,Champlain,For-Profit,,C,98,,,98,,,,98,,,,,,,,,6/30/2025,Yes,
NH2922,EXTENDICARE LAURIER MANOR,Extendicare (Canada) Inc.,Extendicare,1715 Montreal Road,"45.4463977, -75.6108387",45.44640,-75.61084,Gloucester,K1J 6N4,Ontario,Canada,Champlain,For-Profit,,C,240,,,240,,,,240,,,,,,,,2,6/30/2025,Yes,
NH1658,EXTENDICARE STARWOOD,Extendicare (Canada) Inc.,Extendicare,114 Starwood Road,"45.3536979, -75.7506606",45.35370,-75.75066,Nepean,K2G 3N5,Ontario,Canada,Champlain,For-Profit,,C,192,,,192,,,,192,,,,,,,,,6/30/2025,Yes,
NH1667,EXTENDICARE MEDEX,Extendicare (Canada) Inc.,Extendicare,1865 Baseline Road,"45.3543546, -75.7583513",45.35435,-75.75835,Ottawa,K2C 3K6,Ontario,Canada,Champlain,For-Profit,,C,193,,,193,,,,193,,,,,,,,,6/30/2025,Yes,
NH1671,EXTENDICARE NEW ORCHARD LODGE,Extendicare (Canada) Inc.,Extendicare,99 New Orchard Avenue,"45.3752535, -75.7790728",45.37525,-75.77907,Ottawa,K2B 5E6,Ontario,Canada,Champlain,For-Profit,,C,111,,,111,,,,109,,2,,,,,,,6/30/2025,Yes,
NH3263,EXTENDICARE WEST END VILLA,Extendicare (Canada) Inc.,Extendicare,2179 Elmira Drive,"45.3546323, -75.7755567",45.35463,-75.77556,Ottawa,K2C 3S1,Ontario,Canada,Champlain,For-Profit,,C,240,,,240,,,,240,,,,,,,,2,6/30/2025,Yes,
NH3437,FOYER ST-VIATEUR NURSING HOME,Genesis Gardens Inc.,Genesis Gardens Inc.,1003 Limoges Road South,"45.2934328, -75.2283783",45.29343,-75.22838,Limoges,K0A 2M0,Ontario,Canada,Champlain,For-Profit,,C,57,,,57,,,,57,,,,,,,,,6/30/2025,Yes,
NH1255,ALMONTE COUNTRY HAVEN,0760444 B.C. Ltd As General Partner on behalf of OMNI Health Care Limited Partnership ,OMNI,333 Country Street,"45.2183584, -76.1902566",45.21836,-76.19026,Almonte,K0A 1A0,Ontario,Canada,Champlain,For-Profit,,C,82,,,82,,,,82,,,,,,,,,6/30/2025,Yes,
NH3421,WOODLAND VILLA,0760444 B.C. Ltd As General Partner on behalf of OMNI Health Care Limited Partnership ,OMNI,30 Milles Roches Road,"45.0337953, -74.8872228",45.03380,-74.88722,Long Sault,K0C 1P0,Ontario,Canada,Champlain,For-Profit,,C,111,,,111,,,,111,,,,,,,,,6/30/2025,Yes,
NH1259,STONERIDGE MANOR,Revera Long Term Care Inc.,Revera,256 High Street,"34.9230103, -81.91956979999999",34.92301,-81.91957,Carleton Place,K7C 1X1,Ontario,Canada,Champlain,For-Profit,,C,60,,,60,,,,60,,,,,,,,,6/30/2025,Yes,
H11240,NORTH LAMBTON LODGE,The Corporation Of The County Of Lambton,County of Lambton,39 Morris Street,,,,Forest,N0N 1J0,Ontario,Canada,Erie St. Clair,Municipal,,A,88,88,,,,,,88,,,,,,,,,Municipal,,
NH4436,EXTENDICARE TECUMSEH,Extendicare (Canada) Inc.,Extendicare,2475 St. Alphonse Street,,,,Tecumseh,N8N 2X2,Ontario,Canada,Erie St. Clair,For-Profit,,A,128,128,,,,,,128,,,,,,,,,6/30/2030,,
NH2842,EXTENDICARE SOUTHWOOD LAKES,Extendicare (Canada) Inc.,Extendicare,1255 North Talbot Road,,,,Windsor,N9G 3A4,Ontario,Canada,Erie St. Clair,For-Profit,,A,150,150,,,,,,150,,,,,,,,,6/20/2030,,
51242,FIDDICK'S NURSING HOME,Fiddicks Nursing Home Limited,Fiddicks Nursing Home Limited,437 First Avenue,,,,Petrolia,N0N 1R0,Ontario,Canada,Erie St. Clair,For-Profit,,A,129,129,,,,,,128,,1,,,,,,,Unknown,,
NH4253,FAIRFIELD PARK,"Lapointe-Fisher Nursing Home, Limited","Lapointe-Fisher Nursing Home, Limited",1934 Dufferin Avenue,,,,Wallaceburg,N8A 4M2,Ontario,Canada,Erie St. Clair,For-Profit,,A,99,99,,,,,,96,,,,3,,,,,6/30/2030,,
HF4637,RIVERVIEW GARDENS,The Corporation Of The Municipality Of Chatham-Kent,Municipality of Chatham-Kent,519 King Street West,,,,Chatham,N7M 1G8,Ontario,Canada,Erie St. Clair,Municipal,,A,320,320,,,,,,317,,3,,,,,,,Municipal,,
NH1088,RIVERSIDE PLACE,Revera Long Term Care Inc.,Revera,3181 Meadowbrook Lane,,,,Windsor,N8T 0A4,Ontario,Canada,Erie St. Clair,For-Profit,,A,96,96,,,,,,96,,,,,,,,,3/2/2032,,
NH1066,ILER LODGE,Revera Long Term Care Inc.,Revera,111 Iler Avenue,,,,Essex,N8M 1T6,Ontario,Canada,Erie St. Clair,For-Profit,,A,104,104,,,,,,104,,,,,,,,,6/30/2030,,
51065,RICHMOND TERRACE,Richmond Terrace Ltd.,Richmond Terrace Ltd.,89 Rankin Avenue,,,,Amherstburg,N9V 1E7,Ontario,Canada,Erie St. Clair,For-Profit,,A,128,128,,,,,,126,,2,,,,,,,Unknown,,Apans Health Services
H23591,FOYER RICHELIEU WELLAND,Foyer Richelieu Welland,Foyer Richelieu Welland,655 Tanguay Avenue,,,,Welland,L3B 6A1,Ontario,Canada,HNHB,Not-For-Profit,,B,62,,62,,,,,62,,,,,,,,3,6/30/2025,Yes,
NH1652,CARLINGVIEW MANOR,Revera Long Term Care Inc.,Revera,2330 Carling Avenue,"45.3671044, -75.7767235",45.36710,-75.77672,Ottawa,K2B 7H1,Ontario,Canada,Champlain,For-Profit,,C,303,,,303,,,,291,12,,,,,,,,6/30/2025,Yes,
NH4791,THE VILLAGE AT ST. CLAIR,Schlegel Villages Inc.,Schlegel Villages Inc.,1800 Talbot Road,,,,Windsor,N9A 6S4,Ontario,Canada,Erie St. Clair,For-Profit,,New,256,,,,,,256,256,,,,,,,,,Unknown,,
NH4727,THE VILLAGE OF ASPEN LAKE,Schlegel Villages Inc.,Schlegel Villages Inc.,9855 McHugh Street,,,,Windsor,N8P 0A6,Ontario,Canada,Erie St. Clair,For-Profit,,A,192,192,,,,,,192,,,,,,,,,Unknown,,
NH1869c,THE PALACE,CVH (No. 6) GP Inc. as general partner of CVH (No. 4) LP,Southbridge,92 Centre Street,"41.8312053, -71.3575953",41.83121,-71.35760,Alexandria,K0C 1A0,Ontario,Canada,Champlain,For-Profit,,C,70,,,70,,,,70,,,,,,,,,6/30/2025,Yes,
NH51093,COUNTRY VILLAGE HEALTH CARE CENTRE,CVH (No. 5) LP,Southbridge,440 County Road 8,,,,Woodslee,N0R 1V0,Ontario,Canada,Erie St. Clair,For-Profit,,A,104,104,,,,,,102,,2,,,,,,,,,Extendicare Assist
NH3325,HELEN HENDERSON NURSING HOME,Gibson Family Health Care,Gibson Family Health Care,343 Amherst Drive,,,,Amherstview,K7N 1X3,Ontario,Canada,South East,For-Profit,,A / B,102,32,70,,,,,102,,,,,,,,2,6/30/2030,Yes,
NH3698c,PINECREST NURSING HOME - PLANTAGENET,CVH (No. 4) GP Inc. as general partner of CVH (No. 4) LP,Southbridge,101 Parent Street,"45.430335, -75.6946097",45.43034,-75.69461,Plantagenet,K0B 1L0,Ontario,Canada,Champlain,For-Profit,,C,60,,,60,,,,60,,,,,,,,,6/30/2025,Yes,
51692,SARSFIELD COLONIAL HOME,Taminagi Inc.,Taminagi Inc.,2861 Colonial Road,"45.4405678, -75.3471078",45.44057,-75.34711,Sarsfield,K0A 3E0,Ontario,Canada,Champlain,For-Profit,,C,46,,,46,,,,46,,,,,,,,,6/30/2025,Yes,
51783,RESIDENCE PRESCOTT ET RUSSELL,United Counties Of Prescott And Russell,United Counties Of Prescott And Russell,1020 Cartier Boulevard,"45.6002265, -74.61370339999999",45.60023,-74.61370,Hawkesbury,K6A 1W7,Ontario,Canada,Champlain,Municipal,,C,146,,,146,,,,142,,2,,2,,,,,Municipal,Yes,
NH1822,GROVE PARK HOME FOR SENIOR CITIZENS,Grove Park Home For Senior Citizens,Grove Park Home For Senior Citizens,234 Cook Street,,,,Barrie,L4M 4H5,Ontario,Canada,North Simcoe Muskoka,Not-For-Profit,,A / C / New,143,10,,62,,,71,143,,,,,,,,,10/28/2023,Yes,
NH4402,TWIN LAKES TERRACE LONG TERM CARE COMMUNITY,S & R Nursing Homes Limited,Steeves & Rozema Group,1310 Murphy Road,,,,Sarnia,N7S 6K5,Ontario,Canada,Erie St. Clair,For-Profit,,A,60,60,,,,,,60,,,,,,,,,Unknown,,
NH4424,HERON TERRACE LONG TERM CARE COMMUNITY,S & R Nursing Homes Limited,Steeves & Rozema Group,11550 McNorton Street,,,,Windsor,N8P 1T9,Ontario,Canada,Erie St. Clair,For-Profit,,A,140,140,,,,,,140,,,,,,,,,Unknown,,
NH4372,AFTON PARK PLACE LONG TERM CARE COMMUNITY,Steeves & Rozema Group,Steeves & Rozema Group,1200 Afton Drive,,,,Sarnia,N7S 6L6,Ontario,Canada,Erie St. Clair,For-Profit,,A,128,128,,,,,,128,,,,,,,,,Unknown,,
H11243,LAMBTON MEADOWVIEW VILLA,The Corporation Of The County Of Lambton,The Corporation Of The County Of Lambton,3958 Petrolia Line,,,,Petrolia,N0N 1R0,Ontario,Canada,Erie St. Clair,Municipal,,A,125,125,,,,,,125,,,,,,,,,Municipal,,
Unknown,HANOVER CARE CENTRE,Hanover Nursing Home Limited,Hanover Nursing Home Limited,700-19th Avenue,,,,Hanover,N4N 3S6,Ontario,Canada,South West,For-Profit,,B,41,,41,,,,,,,,,,,,,,6/30/2025,Yes,
53090,VALLEY MANOR NURSING HOME,Valley Manor Inc.,Valley Manor Inc.,88 Mintha Street,"45.4860666, -77.6890543",45.48607,-77.68905,Barry's Bay,K0J 1B0,Ontario,Canada,Champlain,Not-For-Profit,,C,90,,,90,,,,90,,,,,,,,,6/30/2025,Yes,
