H21070,LEAMINGTON MENNONITE HOME,The Leamington United Mennonite Home And Apartments,The Leamington United Mennonite Home And Apartments,35 Pickwick Drive,,,,Leamington,N8H 4X5,Ontario,Canada,Erie St. Clair,Not-For-Profit,,A,84,84,,,,,,84,,,,,,,,,Unknown,,
Unknown,MALDEN PARK CONTINUING CARE CENTRE,Windsor Regional Hospital,Windsor Regional Hospital,1453 Prince Road,,,,Windsor,N9C 3Z4,Ontario,Canada,Erie St. Clair,Not-For-Profit,Yes,,145,,,,,,,,,,,,,,,,Unknown,,
NH4398,MAPLE PARK LODGE,1365853 Ontario Limited,1365853 Ontario Limited,6 Hagey Avenue,,,,Fort Erie,L2A 5M5,Ontario,Canada,HNHB,For-Profit,,New,96,,,,,,96,96,,,,,,,,,6/30/2035,,
HGN53631,HERITAGE GREEN NURSING HOME,Heritage Green Nursing Home,Heritage Green Nursing Home,353 Isaac Brock Drive,,,,Stoney Creek,L8J 2J3,Ontario,Canada,HNHB,Not-For-Profit,,B / New,167,,111,,,,167,167,,,,,,,,,6/30/2035,Yes,
NH4262,HILLCREST VILLAGE CARE CENTRE,Hillcrest Village Inc.,Hillcrest Village Inc.,255 Russell Street,,,,Midland,L4R 5L6,Ontario,Canada,North Simcoe Muskoka,For-Profit,,A / New,164,100,,,,,64,162,,,,2,,,,,2030,,
NH3267,CHATEAU PARK LONG TERM CARE HOME,Chateau Park Long Term Care Home,Chateau Park Long Term Care Home,2990 B Riverside Drive West,"42.308029, -83.0737709",42.30803,-83.07377,Windsor,N9C 1A2,Ontario,Canada,Erie St. Clair,For-Profit,,C,59,,,59,,,,59,,,,,,,,,6/30/2025,Yes,
H21531,"ALBRIGHT GARDENS HOMES, INCORPORATED","Albright Gardens Homes, Inc.","Albright Gardens Homes, Inc.",5050 Hillside Drive,,,,Beamsville,L0R 1B2,Ontario,Canada,HNHB,Not-For-Profit,,New,231,,,,,,231,231,,,,,,,,,6/30/2035,,
NH3424,FAITH MANOR NURSING HOME,Holland Christian Homes Inc.,Holland Christian Homes Inc.,7900 Mclaughlin Road South,,,,Brampton,L6Y 5A7,Ontario,Canada,Central West,Not-For-Profit,,B,120,,120,,,,,120,,,,,,,,,6/30/2030,Yes,
NH4403,BELLA SENIOR CARE RESIDENCES INC.,Bella Senior Care Residences Inc.,Bella Senior Care Residences Inc.,8720 Willoughby Drive,,,,Niagara Falls,L2G 7X3,Ontario,Canada,HNHB,For-Profit,,New,160,,,,,,160,160,,,,,,,,,6/30/2035,,Extendicare Assist
NH1069,FRANKLIN GARDENS LONG TERM CARE HOME,Franklin Gardens LTCH,Franklin Gardens LTCH,24 Franklin Road,"39.7707797, -86.0262515",39.77078,-86.02625,Leamington,N8H 4B7,Ontario,Canada,Erie St. Clair,For-Profit,,C,120,,,120,,,,112,8,,,,,,,,6/30/2025,Yes,
HN1556,HEIDEHOF LONG TERM CARE HOME,"Benevolent Society ""heidehof"" For The Care Of The Aged","Benevolent Society ""heidehof"" For The Care Of The Aged",600 Lake Street,,,,St. Catharines,L2N 4J4,Ontario,Canada,HNHB,Not-For-Profit,,New,106,,,,,,106,106,,,,,,,,,6/30/2035,,
NH4441,CHARTWELL BRANT CENTRE LONG TERM CARE RESIDENCE,Regency LTC Operating Limited Partnership on behalf of Regency Operator GP Inc. as General Partner,Chartwell,1182 Northshore Blvd. East,,,,Burlington,L7S 1C5,Ontario,Canada,HNHB,For-Profit,,New,175,,,,,,175,175,,,,,,,,,6/30/2035,,
H21823,IOOF SENIORS HOME,IOOF Seniors Homes Inc.,IOOF Seniors Homes Inc.,10 Brooks Street,,,,Barrie,L4N 5L3,Ontario,Canada,North Simcoe Muskoka,Not-For-Profit,,A / C,182,96,,86,,,,161,20,1,,,,,,,Unknown,Yes,
Unknown,SOUTHAMPTON CARE CENTRE,Jarlette Health Services,Jarlette,140 Grey Street,,,,Southampton,N0H 2L0,Ontario,Canada,South West,For-Profit,,A / B,88,34,54,,,,,88,,,,,,,,,6/30/2025,,
NH4464,CHARTWELL WILLOWGROVE LONG TERM CARE RESIDENCE,Regency LTC Operating Limited Partnership on behalf of Regency Operator GP Inc. as General Partner,Chartwell,1217 Old Mohawk Road,,,,Ancaster,L9K 1P6,Ontario,Canada,HNHB,For-Profit,,New,169,,,,,,169,169,,,,,,,,,6/30/2035,,
NH3244,TEMISKAMING LODGE,Jarlette Health Services,Jarlette,100 Bruce Street,,,,Haileybury,P0J 1K0,Ontario,Canada,North East,For-Profit,,B / C,82,,81,2,,,,79,,1,,2,,,,1,6/30/2025,Yes,
NH3336c,STAYNER CARE CENTRE,Stayner Care Centre Inc.,Jarlette,244 Main Street East 7308 Highway #26,,,,Stayner,L0M 1S0,Ontario,Canada,North Simcoe Muskoka,For-Profit,,B,50,,49,,,,,49,,,,,,,1,,6/30/2025,Yes,
NH1846,THE VILLA CARE CENTRE,Jarlette Health Services,Jarlette,689 Yonge Street,,,,Midland,L4R 2E1,Ontario,Canada,North Simcoe Muskoka,For-Profit,,B,109,,109,,,,,108,,1,,,,,,5,6/30/2025,Yes,
Unknown,MEADOW PARK NURSING HOME (CHATHAM),Jarlette Health Services,Jarlette,110 Sandy Street,"30.3961257, -92.2063944",30.39613,-92.20639,Chatham,N7L 4X3,Ontario,Canada,Erie St. Clair,For-Profit,,C,99,,,99,,,,99,,,,,,,,,6/30/2025,,
NH1075,BROUILLETTE MANOR,1230839 Ontario Limited,"Lapointe-Fisher Nursing Home, Limited",11900 Brouillette Court,"42.3064019, -82.8920717",42.30640,-82.89207,Tecumseh,N8N 4X8,Ontario,Canada,Erie St. Clair,For-Profit,,C,60,,,60,,,,60,,,,,,,,,6/30/2025,Yes,
H11011,JOHN NOBLE HOME,Corporation of the City of Brantford and Corporation of the County of Brant,City of Brantford and Corporation of the County of Brant,97 Mount Pleasant Street,,,,Brantford,N3T 1T5,Ontario,Canada,HNHB,Municipal,,New,156,,,,,,156,153,,,,3,,,,,Municipal,,
H11992,MACASSA  LODGE,City Of Hamilton,City Of Hamilton,701 Upper Sherman Avenue,,,,Hamilton,L8V 3M7,Ontario,Canada,HNHB,Municipal,,A,270,270,,,,,,270,,,,,,,,,Municipal,,
NH4501,MILLENNIUM TRAIL MANOR,955464 Ontario Ltd,Conmed Health Care Group,6861 Oakwood Drive,,,,Niagara Falls,L2E 6S5,Ontario,Canada,HNHB,For-Profit,,New,160,,,,,,160,160,,,,,,,,,6/30/2035,,
NH3554,REGENCY PARK LONG TERM CARE HOME,Meritas Care Corporation,Meritas Care Corporation,567 Victoria Avenue,"42.3136214, -83.0393192",42.31362,-83.03932,Windsor,N9A 4N1,Ontario,Canada,Erie St. Clair,For-Profit,,C,72,,,72,,,,72,,,,,,,,,6/30/2025,Yes,
NH4365,EXTENDICARE HAMILTON,Extendicare (Canada) Inc.,Extendicare,90 Chedmac Drive,,,,Hamilton,L9C 7S6,Ontario,Canada,HNHB,For-Profit,,New,160,,,,,,160,160,,,,,,,,,6/30/2035,,
51253,WATFORD QUALITY CARE CENTRE,QCC Corp.,QCC Corp.,344 Victoria Street,"29.8353771, -95.39552979999999",29.83538,-95.39553,Watford,N0M 2S0,Ontario,Canada,Erie St. Clair,For-Profit,,C,63,,,63,,,,62,,1,,,,,,,6/30/2025,Yes,
NH1083d,BANWELL GARDENS CARE CENTRE,Rykka Care Centres LP,Responsive Health Management Inc.,3000 Banwell Road,"42.3108746, -82.89997609999999",42.31087,-82.89998,Tecumseh,N8N 2M4,Ontario,Canada,Erie St. Clair,For-Profit,,C,142,,,142,,,,140,,2,,,,,,,6/30/2025,Yes,
NH4626,EDGEWATER GARDENS LONG TERM CARE CENTRE,Haldimand War Memorial Hospital,Haldimand War Memorial Hospital,428 Broad Street West,,,,Dunnville,N1A 1T3,Ontario,Canada,HNHB,Not-For-Profit,,New,64,,,,,,64,64,,,,,,,,,4/2/2041,,
NH1725,KING NURSING HOME,King Nursing Home Limited,King Nursing Home Limited,49 Sterne Street,,,,Bolton,L7E 1B9,Ontario,Canada,Central West,For-Profit,,B / C,86,,30,56,,,,84,,2,,,,,,,6/30/2025,Yes,
NH4432,THE HENLEY HOUSE,Henley House Limited,Primacare Living,20 Ernest Street,,,,St. Catharines,L2N 7T2,Ontario,Canada,HNHB,For-Profit,,New,160,,,,,,160,160,,,,,,,,,6/30/2035,,
NH1990,IDLEWYLD MANOR,Idlewyld Manor,Idlewyld Manor,449 Sanatorium Road,,,,Hamilton,L9C 2A7,Ontario,Canada,HNHB,Not-For-Profit,,New,192,,,,,,192,192,,,,,,,,,6/30/2035,,
NH1074c,BERKSHIRE CARE CENTRE,Rykka Care Centres LP,Responsive Health Management Inc.,350 Dougall Avenue,"42.31630819999999, -83.04161549999999",42.31631,-83.04162,Windsor,N9A 4P4,Ontario,Canada,Erie St. Clair,For-Profit,,C,231,,,231,,,,208,15,2,,,6,,,,6/30/2025,Yes,
NH4826b,ROYAL ROSE PLACE,859530 Ontario Inc.,Jarlette,635 Prince Charles Drive North,,,,Welland,L3C 0C7,Ontario,Canada,HNHB,For-Profit,,New,96,,,,,,96,96,,,,,,,,,6/27/2036,,
NH4457,REGINA GARDENS,Liuna Local 837 Nursing Home (Ancaster) Corporation,Liuna Local 837 Nursing Home (Ancaster) Corporation,536 Upper Paradise Road,,,,Hamilton,L9C 5E3,Ontario,Canada,HNHB,Not-For-Profit,,New,128,,,,,,128,128,,,,,,,,,6/30/2035,,Chartwell Seniors Housing Reit
NH4358,QUEEN'S GARDEN,Liuna Local 837 Nursing Home (Hamilton) Corporation,Liuna Local 837 Nursing Home (Hamilton) Corporation,80 Queen Street North,,,,Hamilton,L8R 3P6,Ontario,Canada,HNHB,Not-For-Profit,,New,128,,,,,,128,128,,,,,,,,,6/30/2035,,Chartwell Seniors Housing Reit
NH4488,BILLINGS COURT MANOR,Maryban Holdings Ltd,Maryban Holdings Ltd,3700 Billings Court,,,,Burlington,L7N 3N6,Ontario,Canada,HNHB,For-Profit,,New,160,,,,,,160,160,,,,,,,,,6/30/2035,,
Unknown,TABOR MANOR,Mennonite Brethren Senior Citizens Home,Mennonite Brethren Senior Citizens Home,1 Tabor Drive,,,,St Catharines,L2N 1V9,Ontario,Canada,HNHB,Not-For-Profit,,New,128,,,,,,128,128,,,,,,,,,8/11/2043,,
NH3243,BLENHEIM COMMUNITY VILLAGE,Revera Long Term Care Inc.,Revera,10 Mary Avenue,"43.0022214, -71.16590149999999",43.00222,-71.16590,Blenheim,N0P 1A0,Ontario,Canada,Erie St. Clair,For-Profit,,C,65,,,65,,,,65,,,,,,,,,6/30/2025,Yes,
NH3581,VILLAGE ON THE RIDGE,Revera Long Term Care Inc.,Revera,9 Myrtle Street,#ERROR!,#ERROR!,,Ridgetown,N0P 2C0,Ontario,Canada,Erie St. Clair,For-Profit,,C,40,,,40,,,,40,,,,,,,,,6/30/2025,Yes,
HF4591,CREEK WAY VILLAGE,The Regional Municipality Of Halton,Municipality Of Halton,5200 Corporate Drive,,,,Burlington,L7L 7G7,Ontario,Canada,HNHB,Municipal,,New,144,,,,,,144,144,,,,,,,,,Municipal,,
H11540,THE MEADOWS OF DORCHESTER,The Regional Municipality Of Niagara,Municipality Of Niagara,6623 Kalar Road,,,,Niagara Falls,L2H 2T3,Ontario,Canada,HNHB,Municipal,,New,120,,,,,,120,120,,,,,,,,1,Municipal,,
H12751,DEER PARK VILLA,The Regional Municipality Of Niagara,Municipality Of Niagara,150 Central Avenue,,,,Grimsby,L3M 4Z3,Ontario,Canada,HNHB,Municipal,,New,39,,,,,,39,39,,,,,,,,1,Municipal,,
H13902,DOUGLAS H. RAPELJE LODGE,The Regional Municipality Of Niagara,Municipality Of Niagara,277 Plymouth Road,,,,Welland,L3B 6E3,Ontario,Canada,HNHB,Municipal,,A,120,120,,,,,,117,,2,,1,,,,,Municipal,,
Unknown,BRAEMAR RETIREMENT CENTRE,Macgowan Nursing Homes Ltd.,Macgowan Nursing Homes Ltd.,719 Josephine Street North,,,,Wingham,N0G 2W0,Ontario,Canada,South West,For-Profit,,B,69,,69,,,,,,,,,,,,,,6/30/2025,Yes,
H14496,THE WOODLANDS OF SUNSET,The Regional Municipality Of Niagara,Municipality Of Niagara,920 Pelham Street,,,,Welland,L3C 1Y5,Ontario,Canada,HNHB,Municipal,,New,120,,,,,,120,120,,,,,,,,1,Municipal,,
H14442,NORTHLAND POINTE,The Regional Municipality Of Niagara,Municipality Of Niagara,2 Fielden Avenue,,,,Port Colborne,L3K 6G4,Ontario,Canada,HNHB,Municipal,,New,150,,,,,,150,150,,,,,,,,1,Municipal,,
H21558,NIAGARA INA GRAFTON GAGE VILLAGE,Niagara Ina Grafton Gage Village,Niagara Ina Grafton Gage Village,413 Linwell Road,,,,St Catharines,L2M 7Y2,Ontario,Canada,HNHB,Not-For-Profit,,A,40,40,,,,,,40,,,,,,,,,6/30/2035,,
NH4596,GARDENVIEW LONG TERM CARE HOME,Parkview Meadows Christian Retirement Village,Parkview Meadows Christian Retirement Village,72 Town Centre Drive,,,,Townsend,N0A 1S0,Ontario,Canada,HNHB,Not-For-Profit,,New,64,,,,,,64,64,,,,,,,,,12/4/2035,,
NH1191,STIRLING MANOR NURSING HOME,Manorcare Partners II,Manorcare Partners II,218 Edward Street,,,,Stirling,K0K 3E0,Ontario,Canada,South East,For-Profit,,B,75,,75,,,,,75,,,,,,,,,6/30/2025,Yes,
Unknown,CEDARWOOD VILLAGE,Maplewood Nursing Home Limited,Maplewood Nursing Home Limited,500 Queensway West,,,,Simcoe,N3Y 4R4,Ontario,Canada,HNHB,For-Profit,,B,91,,88,,,,,,,,,,,,,,6/30/2025,Yes,
Unknown,MAPLE MANOR NURSING HOME,Maplewood Nursing Home Limited,Maplewood Nursing Home Limited,73 Bidwell Street,,,,Tillsonburg,N4G 3T8,Ontario,Canada,South West,For-Profit,,B,106,,44,,,,,,,,,,,,,,6/30/2025,Yes,
NH3253,MARIANHILL NURSING HOME,Marianhill Inc.,Marianhill Inc.,600 Cecelia Street,,,,Pembroke,K8A 7Z3,Ontario,Canada,Champlain,Not-For-Profit,,B,134,,134,,,,,131,,1,,2,,,,8,6/30/2025,Yes,
NH1250,SUMAC LODGE,Revera Long Term Care Inc.,Revera,1464 Blackwell Road,"43.0102935, -82.3466725",43.01029,-82.34667,Sarnia,N7S 5M4,Ontario,Canada,Erie St. Clair,For-Profit,,C,100,,,100,,,,96,,,,,4,,,,6/30/2025,Yes,
NH54474,ARBOUR CREEK LONG-TERM CARE CENTRE,Rykka Care Centres LP,Responsive Health Management Inc.,2717 King Street East,,,,Hamilton,L8G 1J3,Ontario,Canada,HNHB,For-Profit,,New,128,,,,,,128,128,,,,,,,,1,6/30/2035,,
NH4331c,BURLOAK,"AXR Operating (National) LP, by its general partners (""AXR"")",Revera,5959 New Street,,,,Burlington,L7L 6W5,Ontario,Canada,HNHB,For-Profit,,New,144,,,,,,144,144,,,,,,,,,6/30/2035,,
NH1252,TRILLIUM VILLA NURSING HOME,S & R Nursing Homes Limited,Steeves & Rozema Group,1221 Michigan Avenue,"34.0174154, -118.4805543",34.01742,-118.48055,Sarnia,N7S 3Y3,Ontario,Canada,Erie St. Clair,For-Profit,,C,152,,,152,,,,142,10,,,,,,,,6/30/2025,Yes,
H21882,MAXVILLE MANOR,Maxville Manor,Maxville Manor,80 Mechanic Street West,,,,Maxville,K0C 1T0,Ontario,Canada,Champlain,Not-For-Profit,,A / C,122,76,,46,,,,120,,2,,,,,,,6/30/2025,Yes,
NH1236,TILBURY MANOR NURSING HOME,Tilbury Manor Nursing Home,Tilbury Manor Nursing Home,16 Fort Street,"41.6272464, -70.9012667",41.62725,-70.90127,Tilbury,N0P 2L0,Ontario,Canada,Erie St. Clair,For-Profit,,C,75,,,75,,,,73,,2,,,,,,,6/30/2025,Yes,
NH4321c,THE MEADOWS,"AXR Operating (National) LP, by its general partners (""AXR"")",Revera,12 Tranquility Avenue,,,,Ancaster,L9G 5C2,Ontario,Canada,HNHB,For-Profit,,New,128,,,,,,128,128,,,,,,,,,Unknown,,
NH3642,THE WELLINGTON NURSING HOME,Barton Retirement Inc.,Barton Retirement Inc.,1430 Upper Wellington Street,"43.2093061, -79.8795145",43.20931,-79.87951,Hamilton,L9A 5H3,Ontario,Canada,HNHB,For-Profit,,C,102,,,102,,,,102,,,,,,,,,6/30/2025,Yes,
NH1969,BAYWOODS PLACE,Revera Long Term Care Inc.,Revera,330 Main Street East,,,,Hamilton,L8N 3T9,Ontario,Canada,HNHB,For-Profit,,Upgraded D,128,,,,,128,,128,,,,,,,,,6/30/2020,Yes,
NH2009,VICTORIA GARDENS LONG TERM CARE,Mirdem Nursing Homes Ltd.,Mirdem Nursing Homes Ltd.,176 Victoria Avenue North,,,,Hamilton,L8L 5G1,Ontario,Canada,HNHB,For-Profit,,B,76,,76,,,,,76,,,,,,,,,6/30/2025,Yes,
NH4330c,RIDGEVIEW,"AXR Operating (National) LP, by its general partners (""AXR"")",Revera,385 Highland Road West,,,,Stoney Creek,L8J 3X9,Ontario,Canada,HNHB,For-Profit,,New,120,,,,,,120,120,,,,,,,,,6/30/2035,,
NH1162c,MAPLE VILLA LONG TERM CARE CENTRE,Better Life LTC Inc.,Better Life LTC Inc.,441 Maple Avenue,"40.430632, -79.8768241",40.43063,-79.87682,Burlington,L7S 1L8,Ontario,Canada,HNHB,For-Profit,,C,93,,,93,,,,93,,,,,,,,,6/30/2025,Yes,
NH2854,THE VILLAGE OF TANSLEY WOODS,Schlegel Villages,Schlegel Villages Inc.,4100 Upper Middle Road,,,,Burlington,L7M 4W8,Ontario,Canada,HNHB,For-Profit,,New,144,,,,,,144,144,,,,,,,,,6/30/2035,,
NH4313,THE VILLAGE OF WENTWORTH HEIGHTS,Schlegel Villages,Schlegel Villages Inc.,1620 Upper Wentworth Street,,,,Hamilton,L9B 2W3,Ontario,Canada,HNHB,For-Profit,,New,120,,,,,,120,120,,,,,,,,,6/30/2035,,
NH1002,FOX RIDGE CARE COMMUNITY,2063414 Ontario Limited as general partner of 2063414 Investment LP,Sienna Senior Living,389 West Street,,,,Brantford,N3R 3V9,Ontario,Canada,HNHB,For-Profit,,C / New,122,,,90,,,32,122,,,,,,,,,6/30/2025,Yes,
Unknown,IROQUOIS LODGE NURSING HOME,Six Nations Of The Grand River,Six Nations Of The Grand River,1755 Chiefswood Road,,,,Ohsweken,N0A 1M0,Ontario,Canada,HNHB,Not-For-Profit,,,50,,,,,,,,,,,,,,,,6/30/2025,,
Unknown,ST. JOSEPH'S MOTHER HOUSE (MARTHA WING),St. Joseph's Health Centre,St. Joseph's Health Centre,574 Northcliffe Avenue,,,,Dundas,L9H 7L9,Ontario,Canada,HNHB,Municipal,,,12,,,,,,,,,,,,,,,,Municipal,,
H24507,ST JOSEPH'S LIFECARE CENTRE,St. Joseph's Health System,St. Joseph's Health System,99 Wayne Gretzky Parkway,,,,Brantford,N3S 6T6,Ontario,Canada,HNHB,Not-For-Profit,,New,160,,,,,,205,205,,,,,,,,,6/30/2035,,
H21966,"ST JOSEPH'S VILLA, DUNDAS",St. Joseph's Health System,St. Joseph's Health System,56 Governor's Road,,,,Dundas,L9H 5G7,Ontario,Canada,HNHB,Not-For-Profit,,New,160,,,,,,390,380,35,8,,2,,,,,10/31/2035,,
NH4463,ST. PETER'S RESIDENCE,St. Peter's Residence,St. Peter's Residence,125 Redfern Avenue,,,,Hamilton,L9C 7W9,Ontario,Canada,HNHB,Not-For-Profit,,New,21,,,,,,210,210,,,,,,,,,6/30/2035,,
NH3620,CAMA WOODLANDS NURSING HOME,The Central Canadian District Of The Christian And Missionary Alliance In Canada,The Central Canadian District Of The Christian And Missionary Alliance In Canada,159 Panin Road,,,,Burlington,L7P 5A6,Ontario,Canada,HNHB,Not-For-Profit,,C / New,134,,,6,,,128,128,,,,,6,,,,11/24/2044,Yes,
H11145,GRANDVIEW LODGE / DUNNVILLE,The Corporation Of Haldimand County,The Corporation Of Haldimand County,657 Lock Street West,,,,Dunnville,N1A 1V9,Ontario,Canada,HNHB,Municipal,,New,128,,,,,,128,128,,,,,,,,,Municipal,,
H11594,NORVIEW LODGE,The Corporation Of Norfolk County,The Corporation Of Norfolk County,44 Rob Blake Way,,,,Simcoe,N3Y 0E3,Ontario,Canada,HNHB,Municipal,,New,179,,,,,,179,179,,,,,,,,,Municipal,,
NH1965,BLACKADAR CONTINUING CARE CENTRE,Blackadar Continuing Care Centre Inc.,Blackadar Continuing Care Centre Inc.,101 Creighton Road,"43.2613584, -79.9673258",43.26136,-79.96733,Dundas,L9H 3B7,Ontario,Canada,HNHB,For-Profit,,C,80,,,80,,,,80,,,,,,,,,6/30/2025,Yes,Extendicare Assist
NH2846,HAMPTON TERRACE CARE CENTRE,Unger Nursing Homes Limited,Unger Nursing Homes Limited,75 Plains Road West,,,,Burlington,L7T 1E8,Ontario,Canada,HNHB,For-Profit,,New,101,,,,,,101,101,,,,,,,,,6/30/2035,,
NH4511,UNITED MENNONITE HOME,United Mennonite Home For The Aged,United Mennonite Home For The Aged,4024 Twenty-Third Street,,,,Vineland,L0R 2C0,Ontario,Canada,HNHB,Not-For-Profit,,New,128,,,,,,128,128,,,,,,,,,6/30/2035,,
Unknown,HARDY TERRACE,Verve Senior Living,Verve Senior Living,612 Mount Pleasant Road,,,,Brantford,N3T 5L5,Ontario,Canada,HNHB,For-Profit,,,101,,,,,,,,,,,,,,,,6/30/2022,,
NH1547,CHARTWELL NIAGARA LONG TERM CARE RESIDENCE,Chartwell Master Care LP,Chartwell,120 Wellington Street,"33.7519387, -84.4380157",33.75194,-84.43802,Niagara-On-The-Lake,L0S 1J0,Ontario,Canada,HNHB,For-Profit,,C,124,,,124,,,,124,,,,,,,,,6/30/2025,Yes,
H11159,LINHAVEN,The Regional Municipality Of Niagara,Municipality Of Niagara,403 Ontario Street,,,,St. Catharines,L2N 1L5,Ontario,Canada,HNHB,Municipal,,B / New,248,,226,,,,22,200,20,2,,3,6,,17,,Municipal,Yes,
NH4375,ALEXANDER PLACE,Waterdown Long Term Care Centre Inc.,Waterdown Long Term Care Inc.,329 Parkside Drive,,,,Waterdown,L0R 2H0,Ontario,Canada,HNHB,For-Profit,,New,128,,,,,,128,126,,2,,,,,,,6/30/2035,,
NH4300,CHARTWELL WENLEIGH LONG TERM CARE RESIDENCE,Regency LTC Operating Limited Partnership on behalf of Regency Operator GP Inc. as General Partner,Chartwell,2065 Leanne Boulevard,,,,Mississauga,L5K 2L6,Ontario,Canada,Mississauga Halton,For-Profit,,A,161,161,,,,,,161,,,,,,,,,6/30/2030,,
54443,CHARTWELL WATERFORD LONG TERM CARE RESIDENCE,Regency LTC Operating Limited Partnership on behalf of Regency Operator GP Inc. as General Partner,Chartwell,2140 Baronwood Drive,,,,Oakville,L6M 4V6,Ontario,Canada,Mississauga Halton,For-Profit,,A,168,168,,,,,,168,,,,,,,,,Unknown,,
54495,CHARTWELL WESTBURY LONG TERM CARE RESIDENCE,Regency LTC Operating Limited Partnership on behalf of Regency Operator GP Inc. as General Partner,Chartwell,495 The West Mall,,,,Etobicoke,M9C 5S3,Ontario,Canada,Mississauga Halton,For-Profit,,A,187,,,,,,,187,,,,,,,,,6/30/2035,,
H14453,WESBURN MANOR,Toronto Long-Term Care Homes And Services,City of Toronto,400 The West Mall,,,,Etobicoke,M9C 5S1,Ontario,Canada,Mississauga Halton,Municipal,,New,192,,,,,,192,191,,1,,,,,,,Municipal,,
NH4445,CAWTHRA GARDENS LIMITED PARTNERSHIP,Delcare LTC Inc.,Delcare LTC Inc.,590 Lolita Gardens,,,,Mississauga,L5A 4N8,Ontario,Canada,Mississauga Halton,For-Profit,,A,192,192,,,,,,189,,,,3,,,,,6/30/2035,,Chartwell Seniors Housing Reit
NH2884,EXTENDICARE MISSISSAUGA,Extendicare (Canada) Inc.,Extendicare,855 John Watt Boulevard,,,,Mississauga,L5W 1G2,Ontario,Canada,Mississauga Halton,For-Profit,,New,140,,,,,,140,140,,,,,,,,,6/30/2030,,
NH4410,EXTENDICARE HALTON HILLS,Extendicare (Canada) Inc.,Extendicare,9 Lindsay Court,,,,Georgetown,L7G 6G9,Ontario,Canada,Mississauga Halton,For-Profit,,New,130,,,,,,130,130,,,,,,,,,6/30/2030,,
53303,CLARION NURSING HOME,Clarion Nursing Homes Limited,Clarion Nursing Homes Limited,337 Highway #8,"43.37116049999999, -80.9724868",43.37116,-80.97249,Stoney Creek,L8G 1E7,Ontario,Canada,HNHB,For-Profit,,C,100,,,100,,,,100,,,,,,,,,6/30/2025,Yes,
54449,WYNDHAM MANOR LONG TERM CARE CENTRE,Halton Healthcare Ltc Inc.,Halton Healthcare Ltc Inc.,291 Reynolds Street,,,,Oakville,L6J 3L5,Ontario,Canada,Mississauga Halton,Not-For-Profit,,A,128,128,,,,,,128,,,,,,,,,6/30/2035,,Extendicare Assist
NH4348,LABDARA LITHUANIAN NURSING HOME,Labdara Foundation,Labdara Foundation,5 Resurrection Road,,,,Toronto,M9A 5G1,Ontario,Canada,Mississauga Halton,Not-For-Profit,,A,90,90,,,,,,90,,,,,,,,,6/30/2035,,Assured Care Consulting Inc.
NH1535,CRESCENT PARK LODGE,955464 Ontario Ltd,Conmed Health Care Group,4 Hagey Avenue,"42.9104404, -78.9232054",42.91044,-78.92321,Fort Erie,L2A 5M5,Ontario,Canada,HNHB,For-Profit,,C,68,,,68,,,,66,,2,,,,,,,6/30/2025,Yes,
NH2855,VILLA FORUM,Villa Forum,Mississauga Italian Canadian Benevolent Association,175 Forum Drive,,,,Mississauga,L4Z 4E5,Ontario,Canada,Mississauga Halton,Not-For-Profit,,A,160,,,,,,,,,,,,,,,,Unknown,,Chartwell Seniors Housing Reit
H11165,ALLENDALE,Regional Municipality of Halton,Municipality of Halton,185 Ontario Street South,,,,Milton,L9T 2M4,Ontario,Canada,Mississauga Halton,Municipal,,A,200,200,,,,,,199,,1,,,,,,,Municipal,,
NH2838,DELHI LONG TERM CARE CENTRE,Delhi Nursing Home Ltd.,Delhi Nursing Home Ltd.,750 Gibraltar Street,#ERROR!,#ERROR!,,Delhi,N4B 3B3,Ontario,Canada,HNHB,For-Profit,,C,60,,,60,,,,60,,,,,,,,,6/30/2025,Yes,
HF4491,POST INN VILLAGE,The Regional Municipality Of Halton,Municipality Of Halton,203 Georgian Drive,,,,Oakville,L6H 7H9,Ontario,Canada,Mississauga Halton,Municipal,,A,228,228,,,,,,211,17,,,,,,,,Municipal,,
Unknown,SENIORS' HEALTH CENTRE,North York General Hospital,North York General Hospital,2 Buchan Court,,,,North York,M2J 5A3,Ontario,Canada,Central,Not-For-Profit,,B,192,,145,,,,,,,,,,,,,,6/30/2030,Yes,
NH1555,EXTENDICARE ST. CATHARINES,Extendicare (Canada) Inc.,Extendicare,283 Pelham Road,"43.1300161, -79.2585423",43.13002,-79.25854,St. Catharines,L2S 1X7,Ontario,Canada,HNHB,For-Profit,,C,152,,,152,,,,152,,,,,,,,1,6/30/2025,Yes,
NH3409,GRACE VILLA NURSING HOME,Grace Villa Limited,Grace Villa Limited,45 Lockton Crescent,"43.2114678, -79.8470931",43.21147,-79.84709,Hamilton,L8V 4V5,Ontario,Canada,HNHB,For-Profit,,C,184,,,184,,,,184,,,,,,,,,6/30/2025,Yes,
NH1545,OAKWOOD PARK LODGE,Maryban Holdings Ltd,Maryban Holdings Ltd,6747 Oakwood Drive,"43.077209, -79.1179393",43.07721,-79.11794,Niagara Falls,L2E 6S5,Ontario,Canada,HNHB,For-Profit,,C,153,,,153,,,,151,,2,,,,,,,6/30/2025,Yes,
H13534,UPPER CANADA LODGE,The Regional Municipality Of Niagara,Municipality Of Niagara,272 Wellington Street,"43.2502043, -79.06946420000001",43.25020,-79.06946,Niagara-On-The-Lake,L0S 1J0,Ontario,Canada,HNHB,Municipal,,C,80,,,80,,,,80,,,,,,,,,Municipal,Yes,
NH3712,WILDWOOD CARE CENTRE INC.,Omni Health Care Group,OMNI,100 Ann Street,,,,St. Marys,N4X 1A1,Ontario,Canada,South West,For-Profit,,B,60,,60,,,,,60,,,,,,,,,6/30/2025,Yes,
H13533,GILMORE LODGE,The Regional Municipality Of Niagara,Municipality Of Niagara,50 Gilmore Road,"42.2747141, -71.54510909999999",42.27471,-71.54511,Fort Erie,L2A 2M1,Ontario,Canada,HNHB,Municipal,,C,80,,,80,,,,80,,,,,,,,,Municipal,Yes,
NH1585,"NIAGARA HEALTH SYSTEM, WELLAND HOSPITAL SITE, EXTENDED CARE UNIT",Niagara Health System,Niagara Health System,155 Ontario Street,"42.6659335, -73.7766287",42.66593,-73.77663,St. Catharines,L2R 5K3,Ontario,Canada,HNHB,Not-For-Profit,,C,75,,,75,,,,75,,,,,,,,40,6/30/2035,Yes,
H11735,SHERIDAN VILLA,The Regional Municipality Of Peel,Municipality Of Peel,2460 Truscott Drive,,,,Mississauga,L5J 3Z8,Ontario,Canada,Mississauga Halton,Municipal,,A,142,142,,,,,,142,,,,,,,,,Municipal,,
NH1156b,WELLINGTON PARK CARE CENTRE,Rykka Care Centres LP,Responsive Health Management Inc.,802 Hager Avenue,"43.3313832, -79.8120331",43.33138,-79.81203,Burlington,L7S 1X2,Ontario,Canada,HNHB,For-Profit,,C,132,,,132,,,,113,19,,,,,,,,6/30/2025,Yes,
NH3645b,ANSON PLACE CARE CENTRE,Rykka Care Centres LP,Responsive Health Management Inc.,85 Main Street North,"30.3273255, -81.6575034",30.32733,-81.65750,Hagersville,N0A 1H0,Ontario,Canada,HNHB,For-Profit,,C,60,,,60,,,,60,,,,,,,,1,6/30/2025,Yes,
NH3401b,DUNDURN PLACE CARE CENTRE,Rykka Care Centres LP,Responsive Health Management Inc.,39 Mary Street,"43.2564179, -79.8639397",43.25642,-79.86394,Hamilton,L8R 3L8,Ontario,Canada,HNHB,For-Profit,,C,201,,,201,,,,168,28,2,,3,,,,,6/30/2025,Yes,
NH3446,PINE VILLA CARE CENTRE,Rykka Care Centres LP,Responsive Health Management Inc.,490 Highway #8,"43.2164086, -79.7160398",43.21641,-79.71604,Stoney Creek,L8G 1G6,Ontario,Canada,HNHB,For-Profit,,C,38,,,38,,,,38,,,,,,,,3,6/30/2025,Yes,
NH3315,BRIERWOOD GARDENS,Revera Long Term Care Inc.,Revera,425 Park Road North,"43.1785314, -80.2474737",43.17853,-80.24747,Brantford,N3R 7G5,Ontario,Canada,HNHB,For-Profit,,C,79,,,79,,,,79,,,,,,,,,6/30/2025,Yes,
NH1561,GARDEN CITY MANOR,Revera Long Term Care Inc.,Revera,168 Scott Street,"43.18089810000001, -79.2489379",43.18090,-79.24894,St. Catharines,L2N 1H2,Ontario,Canada,HNHB,For-Profit,,C,200,,,200,,,,198,,2,,,,,,,6/30/2025,Yes,
NH3410,TELFER PLACE,Revera Long Term Care Inc.,Revera,245 Grand River Street North,"43.2072087, -80.3865058",43.20721,-80.38651,Paris,N3L 3V8,Ontario,Canada,HNHB,For-Profit,,C,45,,,45,,,,45,,,,,,,,,6/30/2025,Yes,
NH2870,WEST OAK VILLAGE,"AXR Operating (National) LP, by its general partners (""AXR"")",Revera,2370 Third Line,,,,Oakville,L6M 4E2,Ontario,Canada,Mississauga Halton,For-Profit,,New,133,,,,,,133,133,,,,,,,,,6/30/2030,,
NH3558,PLEASANT MEADOW MANOR,0760444 B.C. Ltd As General Partner on behalf of OMNI Health Care Limited Partnership ,OMNI,99 Alma Street,,,,Norwood,K0L 2V0,Ontario,Canada,Central East,For-Profit,,B,61,,61,,,,,61,,,,,,,,,6/30/2025,Yes,
NH1536,KILEAN LODGE,Revera Long Term Care Inc.,Revera,83 Main Street East,#ERROR!,#ERROR!,,Grimsby,L3M 1N6,Ontario,Canada,HNHB,For-Profit,,C,50,,,50,,,,49,,1,,,,,,,6/30/2025,Yes,
